{
	"$schema": "http://json-schema.org/draft-07/schema#",
	"title": "Force-multiplier effects for the goal engine",
	"type": "object",
	"required": [
		"source",
		"generated",
		"baseTravelFactor",
		"minTravelFactor",
		"effects"
	],
	"additionalProperties": false,
	"properties": {
		"$schema": {
			"type": "string"
		},
		"source": {
			"type": "string"
		},
		"generated": {
			"type": "string",
			"pattern": "^\\d{4}-\\d{2}-\\d{2}$"
		},
		"baseTravelFactor": {
			"type": "number",
			"minimum": 1
		},
		"minTravelFactor": {
			"type": "number",
			"minimum": 0.5
		},
		"effects": {
			"type": "array",
			"minItems": 5,
			"items": {
				"type": "object",
				"required": [
					"id",
					"name",
					"active",
					"travelDelta",
					"note",
					"provenance"
				],
				"additionalProperties": false,
				"properties": {
					"id": {
						"type": "string",
						"minLength": 1
					},
					"name": {
						"type": "string",
						"minLength": 1
					},
					"active": {
						"type": "string",
						"minLength": 1
					},
					"travelDelta": {
						"type": "number",
						"minimum": 0
					},
					"note": {
						"type": "string"
					},
					"provenance": {
						"type": "string",
						"minLength": 1
					}
				}
			}
		}
	}
}